code_id;nom_du_jardin;adresse;code_postal;ville;region;departement;coordonnees_x;coordonnees_y;descriptif;site_web;facebook;twitter;instagram;dailymotion;tag_annee_de_labellisation;tag_jardin_remarquable;tag_maison_des_illustres;tag_monument_historique;tag_protection_site;tag_tourisme_et_handicap;tag_musee_de_france;tag_architecture_contemporaine_remarquable;tag_vpah;tag_patrimoine_mondial_de_lunesco;tag_jardin_prive;tag_jardin_contemporain;tag_parc_paysager;tag_jardin_regulier;tag_jardin_de_collection;tag_jardin_public;tag_jardin_vivrier;tag_jardin_inspiration_medievale;coordonnees_geographiques
MHR_76_JR0001;Jardin de l'abbaye de Fontfroide;Abbaye de Fontfroide - D 613;11100;Narbonne;Occitanie;Aude;43.12736881;2.898539901;"L'abbaye de Fontfroide est un haut lieu de culture et d'histoire, mêlant pureté et rigueur de l'architecture cistercienne et majesté des paysages. Implantés sur la colline, les jardins en terrasses de Fontfroide ont été remaniés au début du XXe siècle par la famille Fayet, ancêtres des propriétaires actuels et font partie de la visite du monument depuis 2015. Le parcours ""historique"" retrace l'histoire des jardins depuis le Moyen-âge au travers de différents jardins thématiques aboutissant à la magnifique roseraie, une des plus grandes du Sud de la France, avec près de 2500 rosiers. Implantée en 1988 derrière l'église sur l'ancien cimetière des moines, elle accueille diverses variétés de rosiers, anciennes ou créations plus récentes. L’autre parcours, appelé ""la promenade du bosquet"", fait la part belle aux espèces méditerranéennes et permet au visiteur d'accéder au point culminant des terrasses le long du mur d'enceinte, offrant une vue d'ensemble sur l'abbaye et le massif qui l'entoure. Des statues du XVIIIe siècle ramenées à Fontfroide par Gustave Fayet jalonnent les allées, alors que des bancs invitent au repos et à la méditation.";http://www.fontfroide.com;https://www.facebook.com/ABBAYEdeFONTFROIDE;https://twitter.com/fontfroide1093;https://www.instagram.com/abbaye_de_fontfroide/;;labellisee-en-2012;jardin-remarquable;;monument-historique;protection-site;;;;;;jardin-prive;;;jardin-regulier;;;;jardin-inspiration-medievale;43.12736881,2.898539901
MHR_76_JR0010;Parc de Flaugergues;1744 avenue Albert Einstein;34000;Montpellier;Occitanie;Hérault;43.60981837;3.919485211;"Construite à la fin du XVIIe siècle, Flaugergues est l'une de ces demeures appelées ""folies"" édifiées dans la campagne montpelliéraine. Les jardins ont étés aménagés au cours de l'histoire sur 4 hectares. La présence de la vigne date de l'époque romaine comme en témoigne la villa romaine au fond du parc (visible sur des photos aériennes).
 Les terrasses et le jardin à la française ont été aménagés par Etienne de Flaugergues en 1700. L'orangerie et le parc à l'anglaise en 1850 par Charles Joseph de Boussairolles. Une étude des jardins a été faite en 1997 par les étudiants de l'école d'architecture de Versailles, afin de redonner un avenir cohérent, ce qui a amené les propriétaires à faire de nombreux réaménagements en particulier, la bambousaie, l'allée des oliviers, l'orangerie et ses alentours, ainsi que la création d'un jardin des sens.";http://www.flaugergues.com;https://www.facebook.com/chateaudeflaugergues/;https://twitter.com/ChatFlaugergues;https://www.instagram.com/chateau_de_flaugergues/;;labellisee-en-2004;jardin-remarquable;;monument-historique;;;;;;;jardin-prive;;parc-paysager;jardin-regulier;;;;;43.60981837,3.919485211
MHR_76_JR0012;Jardin des carrières de Saint-Adrien;RN 113;34290;Servian;Occitanie;Hérault;43.39785893;3.325733989;Le jardin de Saint Adrien fait partie des sites les plus spectaculaires de notre région : d’anciennes carrières datant du Moyen-âge ont été transformées peu à peu en bassins avec écrin de verdure, paradoxale oasis posée sur les roches volcaniques. Quatre plans d'eau apportent la fraîcheur dans ce paysage minéral tandis que les plantations et les fleurs en font une halte estivale sous le signe de la magie et de la sérénité.;http://www.stadrien.paysdepezenas.com;https://www.facebook.com/LeJardinDeSaintAdrien;;;;labellisee-en-2004;jardin-remarquable;;;;;;;;;jardin-prive;;parc-paysager;;;;;;43.39785893,3.325733989
MHR_76_JR0013;Parc et jardin du château de Margon;rue des Banastes;34320;Margon;Occitanie;Hérault;43.4864371;3.307161033;Ce sont des jardins réguliers de composition classique à la française avec le côté structuré du jardin à l’italienne. On y trouve des cyprès en colonne, des topiaires en lauriers sauce, des allées bordées de lauriers roses, des grenadiers à fruit ou à fleur, des oliviers taillés en tambour et une collection d’iris.;http://chateaudemargon.com;https://www.facebook.com/chateaudemargon;;https://www.instagram.com/chateau_de_margon/;;labellisee-en-2004;jardin-remarquable;;monument-historique;;;;;;;jardin-prive;;;jardin-regulier;;;;;43.4864371,3.307161033
MHR_76_JR0016;Parc aux bambous;Broques;09500;Lapenne;Occitanie;Ariège;43.145869;1.730409;Dans un cadre de verdure, au bord d'une rivière, sur plus de 4 hestares, le Parc aux Bambous vous invite à découvrir au milieu d'arbres centenaires une collection de plus de 100 espèces : des nains au géants qui peuvent pousser de plus de 50 cm par jour. Des sentiers aménagés vous feront parcourir : le jardin de fleurs, le labyrinthe de bambous, des plans d'eau, des bancs à l'ombre… Le parc est à la fois un jardin de collection sur le bambou (une centaine de taxons) et les graminées (une cinquantaine de taxons).;http://www.parcauxbambous.com;https://www.facebook.com/Le-Parc-Aux-Bambous-1550833061817223/;;;;labellisee-en-2006;jardin-remarquable;;;;;;;;;jardin-prive;;;;jardin-de-collection;;;;43.145869,1.730409
MHR_76_JR0017;Jardin de l'abbaye de Combelongue;Abbaye de Combelongue;09420;Rimont;Occitanie;Ariège;42.988;1.27639;Le jardin s'ordonne sur un principe de perspectives et sur le thème d'une évocation des jardins à travers les âges : jardin médiéval tracé sur le plan du paradis terrestre, chambre de verdure Renaissance et sa sphère armillaire, grande nef de verdure, théâtre de verdure à l'italienne, verger et évocation contemporaine du jardin à la française : terrasse de buis, grande perspective et parterres ponctués de topiaires. Les différentes perspectives du jardin ouvrent sur le domaine agricole de l'abbaye, constitué de pâturages paysagers à l'anglaise traversés de cours d'eau.;http://www.abbayedecombelongue.fr;;;;;labellisee-en-2013;jardin-remarquable;;;;;;;;;jardin-prive;;parc-paysager;jardin-regulier;;;;;42.988,1.27639
MHR_76_JR0019;Palmeraie du Sarthou;Au Sarthou;32110;Betous;Occitanie;Gers;43.7140254;0.0324110;Issu de notre passion pour les palmiers, prolongement naturel de notre jardin, vous y découvrirez les nombreuses variétés de plantes tropicales qui prospèrent dans notre petite oasis. Parmi celles-ci, une dizaine d'espèces de palmiers, plus encore de bambous, des figuiers de barbarie, des cannes à sucre, des papyrus... Quand on pénètre sous le couvert dense de la palmeraie, cela ressemble à une petite forêt tropicale, sombre et humide. Les troncs chevelus du palmier de Chine, plantés serrés, constitue un véritable dédale où l'on perd tout sens de l'orientation. Le cheminement conduit ensuite à la bananeraie puis à la pépinière des plantes tropicales. Les feuillages des végétaux, tant par leur forme que par leur taille, créent une ambiance exotique et suscitent un sentiment réel de dépaysement.;http://www.palmeraiesarthou.com;https://www.facebook.com/palmeraiesarthou/;;;;labellisee-en-2006;jardin-remarquable;;;;;;;;;jardin-prive;;;;jardin-de-collection;;;;43.7140254,0.032411
MHR_76_JR0021;Jardin japonais de Compans-Cafarelli;rue Ozenne;31000;Toulouse;Occitanie;Haute-Garonne;43.61207700;1.432321000;Ce parc clos de 7 000 m² fait partie d'un espace vert de 10 hectares en plein cœur du quartier récent de Compans-Caffarelli. Assez rare dans une ville méridionale telle que Toulouse, ce jardin propose des variétés botaniques de l'extrême-orient. Conçu par le bureau d'étude du service des jardins et des espaces verts comme un lieu de méditation, on y trouve un jardin minéral, un pont en bois rouge typiquement japonais reliant un îlot qui représente allégoriquement le paradis. Il s'inspire des jardins créés à Kyoto entre le XIVe siècle et XVIe siècle, correspondant aux époques de Muromachi et d'Edo. Il est isolé du reste du parc grâce à des rideaux de verdure et une colline offrant une certaine intimité. Le jardin est composé d'un jardin sec avec une île Grue, une île Tortue et neuf rochers, d'un lac, d'un pavillon de thé, et d'un jardin planté composé d'une cascade sèche, des pas japonais, une lanternes, un pont rouge, une île du Paradis, un mont Fuji et les pierres des trois saints.;https://www.parcsetjardins.fr/jardins/794-jardin-japonais-de-compans-caffarelli;;;;;labellisee-en-2006;jardin-remarquable;;;;;;;;;;jardin-contemporain;;;;jardin-public;;;43.612077,1.432321
MHR_76_JR0023;Jardin Massey;rue Massey;65000;Tarbes;Occitanie;Hautes-Pyrénées;43.2373245;0.076560974;Parc public d'agrément de 11 hectares clôturé d'une grille monumentale sur 1,2 km de longueur. Romantique et paysager, ancienne propriété de Placide Massey, célèbre botaniste du XIXe siècle, aujourd'hui musée. Arboretum de plus de 5 000 arbres et arbustes du monde entier, collection de plantes succulentes, pièce d'eau, orangerie, serre, cloître médiéval, statuaire, musée. Paons, compositions florales.;http://www.tarbes.fr;;;;;labellisee-en-2004;jardin-remarquable;;monument-historique;;;;;;;;;parc-paysager;jardin-regulier;jardin-de-collection;jardin-public;;;43.2373245,0.076560974
MHR_76_JR0025;Jardins secrets;Boulevard Gambetta;46000;Cahors;Occitanie;Lot-et-Garonne;44.45660144;1.439042687;Occupant places, placettes ou encoignures de ruelles, vingt-cinq jardins à deviner, chacun mis en scène sur un thème spécifique relié au passé médiéval de Cahors et mettant en valeur son patrimoine monumental.;http://www.tourisme-cahors.fr/decouvrir/pierre-et-histoire/visiter-cahors/jardins-secrets;https://www.facebook.com/cahorstourisme;;;;labellisee-en-2006;jardin-remarquable;;;;;;;;patrimoine-mondial-de-lunesco;;jardin-contemporain;;;;jardin-public;;jardin-inspiration-medievale;44.45660144,1.439042687
MHR_76_JR0031;Jardin des Martels;Les Martels;81500;Giroussens;Occitanie;Tarn;43.74961225;1.786538959;Jardin privé de 3,5 hectares à l'anglaise. Plus de 2 600 variétés. Serre exotique aquatique. Labyrinthe de bambous. Pagode artisanale balinaise. Collection de nymphéas et de lotus. Temple du lotus. Mini-ferme. Belvédère sur jardins en terrasse. Jardinerie.;http://www.jardinsdesmartels.com;https://www.facebook.com/JardinsDesMartels;;;;labellisee-en-2006;jardin-remarquable;;;;;;;;;jardin-prive;;parc-paysager;;;;;;43.74961225,1.786538959
MHR_76_JR0032;Les jardins de Quercy;Cambou;82330;Verfeil-sur-Seye;Occitanie;Tarn-et-Garonne;44.17271657;1.881821752;"Sur un hectare privé de terrain en pente, jardins thématiques de différente taille, clos par des haies. Une dizaine de jardins : blanc, végétal, à l'anglaise, australien, indien, labyrinthe... Nouveau cette année : le jardin des ruines romaines.
 Nombreuses variétés rares de vivaces, de rosiers.";http://www.lesjardinsdequercy.fr;;;https://www.instagram.com/lesjardinsdequercy/;;labellisee-en-2008;jardin-remarquable;;;;;;;;;jardin-prive;jardin-contemporain;parc-paysager;;;;;;44.17271657,1.881821752
MHR_76_JR0034;Jardin d’En Galinou;En Galinou;31460;Caraman;Occitanie;Haute-Garonne;43.52708;1.78253;Quand nous sommes arrivés, le terrain était une friche carrée, de 8000 m2 en légère pente vers le sud, avec une source captée juste dans l'angle Nord-Est. Il a fallu tout faire à partir de rien, c'est ce qui nous plaisait. On a commencé par des arbres à l'est pour nous protéger du vent d'autan, puis on a planté les rocailles et les plates-bandes. Tout le travail de plantation, de taille, d'arrachage doit aboutir à ce qu'on voit un paysage et non pas un jardin. On met une plante là où nous pensons qu'elle sera bien et non pas là où elle ferait bien. Une grande rocaille traverse le jardin d'ouest en est le long d'une cassure de la pente. Cette rocaille s'est étendue petit à petit, d'abord à l'ouest, puis à l'est (temps de travail : deux heures à deux par m2 de rocaille). Elle fait 300 m2 maintenant. Il nous a fallu 5 ans pour la construire. Puis on a créé des plate-bandes au nord de cette rocaille, des bassins pour prolonger la source, enfin on s'attaque au sud.;http://www.galinou.fr;https://www.facebook.com/EnGalinou/;;;;labellisee-en-2015;jardin-remarquable;;;;;;;;;jardin-prive;jardin-contemporain;;;;;;;43.52708,1.78253
MHR_32_JR0003;Le parc de Barbieux;avenue Jean Jaurès/avenue Le Nôtre;59100;Roubaix;Hauts-de-France;Nord;50.678691;3.161981;Jardin agrée par l'association des Parcs et Jardins du Nord/Pas-de-Calais. Le parc de Barbieux possède un fort potentiel environnemental : c'est un réservoir de biodiversité. Avec plus de 60 espèces végétales recensées, il constitue un véritable arboretum dans lequel la majorité des essences est représentée par plus de trois individus. Avec les origines diverses des végétaux, le promeneur peut réaliser un tour du monde botanique. On distinguera parmi tant d'autres le cyprès chauve des Etats unis, le savonnier des Antilles, le Paulownia, le Ginkgo biloba–arbre aux 40 écus ou le Phellodendron-arbre au liège de l'amour, tous trois originaires de Chine... Ce parc de 34 hectares, est aussi une aire de refuge pour l'avifaune, on peut y rencontrer au détour d'un bosquet plus de 50 espèces.;http://www.mairie-roubaix.fr;;;;;labellisee-en-2011;jardin-remarquable;;;protection-site;;;;;;;;parc-paysager;;;jardin-public;;;50.678691,3.161981
MHR_32_JR0005;Le jardin des Lianes;8 rue des Capucins;62140;Chériennes;Hauts-de-France;Pas-de-Calais;50.31272884;2.051986456;Ce jardin de 5400 m2 se veut libre, romantique, parfumé, coloré et facile d'entretien. Il est structuré à partir d'arbres et d’arbustes de collection, qui offrent une grande diversité de feuillages, assurant de la couleur du printemps jusqu'à l’automne. Aux parfums des viburnums et autres arbustes à fleurs succèdent ceux de 400 variétés de roses anciennes ou anglaises que l'on peut apprécier au détour de nombreuses petites allées. Une très belle collection d'hydrangéa (environ 180 variétés dont de nombreux cultivars japonais) vient aussi varier les plaisirs, offrant avec les vivaces des fleurs à admirer jusqu'aux gelées. Un pigeonnier, un petit puits, quelques cabanes, de nombreuses gloriettes et bancs participent à son décor.;http://jardindeslianes.fr;;;;;labellisee-en-2006;jardin-remarquable;;;;;;;;;jardin-prive;jardin-contemporain;parc-paysager;;jardin-de-collection;;;;50.31272884,2.051986456
MHR_32_JR0007;Jardins du manoir d'Hénocq;7 rue de la Creuse;62170;Bréxent-Énocq;Hauts-de-France;Pas-de-Calais;50.51;1.73;"Jardin créé en 2001 sur un ancien fief féodal, à l'arrière d'un manoir du XVIème siècle.
 Jardin témoignant de ""l'art de vivre"" dans les jardins au Moyen-Age par sa géométrie, sa symbolique, sa botanique.";http://www,jardinsdhenocq.com;;;;;labellisee-en-2015;jardin-remarquable;;;;;;;;;jardin-prive;jardin-contemporain;;;;;jardin-vivrier;jardin-inspiration-medievale;50.51,1.73
MHR_32_JR0011;Jardins du château;3 rue de l'Eglise;02120;Puisieux-Clanlieu;Hauts-de-France;Aisne;49.87013913;3.647236973;Autour d'un château du XVIIIe siècle, le parc de 4 hectares et le jardin comprennent un arboretum avec des arbres séculaires (cèdre du Liban de 30m de haut et 7m20 de circonférence, érables, séquoias, châtaigniers), un jardin à la française, des collections de pivoines, rhododendrons, hydrangéas, topiaires, rosiers et houx.;http://www.puisieux.com;;;;;labellisee-en-2006;jardin-remarquable;;;;;;;;;jardin-prive;;parc-paysager;jardin-regulier;;;;;49.87013913,3.647236973
MHR_32_JR0012;Jardins du château de Viels-Maisons;11 place du Marché;02540;Viels-Maisons;Hauts-de-France;Aisne;48.895548;3.396919;Au chevet d'une vieille église, entourée d'un parc du XVIIe siècle (ISMH) et d'un château du début du XIXe siècle, une succession de jardins dessinés par la paysagiste Sonja Gauron : un jardin de curé, de roses et de plantes officinales, un jardin anglais, camaïeu de couleurs, puis un jardin blanc, un jardin romantique, un jardin d'eau, un jardin sauvage des hydrangeas, des rhododendrons et un cadran solaire analemmatique.;http://jardins-vielsmaisons.net;;;;;labellisee-en-2004;jardin-remarquable;;monument-historique;;;;;;;jardin-prive;jardin-contemporain;parc-paysager;jardin-regulier;;;jardin-vivrier;;48.895548,3.396919
MHR_32_JR0016;Roseraie de l'abbaye de Chaalis;Musée Jacquemart André;60300;Fontaine-Chaalis;Hauts-de-France;Oise;49.18745374;2.621397972;Un parc romantique propice à la promenade, avec sa magnifique roseraie, ses parterres à la française et son parcours de senteurs.;http://www.chaalis.fr;;;;;labellisee-en-2004;jardin-remarquable;;;;;;;;;;;parc-paysager;jardin-regulier;jardin-de-collection;jardin-public;;;49.18745374,2.621397972
MHR_32_JR0017;Jardin Henri Le Sidaner;7 rue Henri Le sidaner;60380;Gerberoy;Hauts-de-France;Oise;49.53321568;1.849249676;Dans l'enceinte de l'ancien château féodal, une partie des terrasses a été aménagée par le peintre post-impressionniste Henri Le Sidaner en un jardin suspendu visible depuis les remparts. Il propose une composition de jardins et bosquets sur plusieurs niveaux (jardin blanc, jardin sauvage, jardin jaune et bleu, roseraie, atelier d'été du peintre).;http//:www.lesjardinshenrilesidaner.com;;;;;labellisee-en-2015;jardin-remarquable;;;protection-site;;;;;;jardin-prive;;;;jardin-de-collection;;;;49.53321568,1.849249676
MHR_32_JR0021;Jardin d’Emonville;place Clémenceau;80100;Abbeville;Hauts-de-France;Somme;50.10547663;1.836830378;Le jardin d’Emonville, créé au XIXe siècle, a été façonné par ses anciens propriétaires pour devenir un jardin d’agrément au milieu duquel fut bâti un bel hôtel particulier. Aujourd’hui jardin public labellisé « Jardin remarquable », il propose un jardin anglo-chinois, un arboretum remarquable, ainsi que des massifs de mosaïculture.;http://www.abbeville.fr;;;;;labellisee-en-2015;jardin-remarquable;;;;;;;;;;;parc-paysager;;;jardin-public;;;50.10547663,1.836830378
MHR_32_JR0024;Jardin du château de Maizicourt;29 route d'Amiens;80370;Maizicourt;Hauts-de-France;Somme;50.15582713;2.126508951;Ce parc paysager de 10 hectares, servant d'écrin à un petit château du XVIIIe siècle, propose une collection de rosiers et d'hydrangeas dans leurs bordures de buis, ainsi qu’une succession de jardins à thèmes réservant des surprises (pivoines, topiaires, fabriques, fontaines et bassins).;http://jardinsdemaizicourt.com;;;;;labellisee-en-2004;jardin-remarquable;;;;;;;;;jardin-prive;jardin-contemporain;parc-paysager;jardin-regulier;jardin-de-collection;;jardin-vivrier;;50.15582713,2.126508951
MHR_84_JR0005;Jardins du château de la Batisse;route de Varennes;63450;Chanonat;Auvergne-Rhône-Alpes;Puy-de-Dôme;45.69186;3.084277;"Au pied du célèbre plateau de Gergovie, niché dans son vallon, le château de La Batisse se laisse découvrir dans son écrin de verdure, baigné d'une charmante rivière.
 Les jardins à la française, dessinés par l'école d'André Le Nôtre,se composent de bassins, cascades, fontaines, grottes bâties et grottes de buis, labyrinthe de verdure, escalier à double révolution, etc.";http://www.chateaudelabatisse.com;https://www.facebook.com/chateaudelabatissevisite/;;;;labellisee-en-2006;jardin-remarquable;;monument-historique;;;;;;;jardin-prive;;parc-paysager;jardin-regulier;;;;;45.69186,3.084277
MHR_84_JR0007;Jardins du château de Cordès;"Route d'Orcival
 Château de Cordès";63210;Orcival;Auvergne-Rhône-Alpes;Puy-de-Dôme;45.70222318;2.839407921;Jardins à la française dessinés en 1695 et attribués à Le Nôtre. Comprenant charmilles et allées de hêtres et de charmes, ils forment un labyrinthe de verdure à partir duquel se dégage une belle perspective sur le Puy de Dôme.;http://www.chateau-cordes-orcival.com;;;;;labellisee-en-2004;jardin-remarquable;;monument-historique;;;;;;;;;;jardin-regulier;;;;;45.70222318,2.839407921
MHR_84_JR0010;Jardin du château de Saint-Bernard;152 avenue Suzanne Valadon;01600;Saint-Bernard;Auvergne-Rhône-Alpes;Ain;45.94480552;4.732521772;Jardin privé de 2 hectares créé en 2003, situé dans le cadre d'un château XVIIe et XIXe siècles. Jardin régulier constitué de carrés thématiques, labyrinthe de 600 pommiers et poiriers, roseraie.;http://www.chateau-de-saint-bernard.fr;https://www.facebook.com/pages/Ch%C3%A2teau-de-Menthon-Saint-Bernard/154305434601340;;https://www.instagram.com/chateaudementhonsaintbernard/;;labellisee-en-2011;jardin-remarquable;;;;;;;;;;jardin-contemporain;;jardin-regulier;jardin-de-collection;;;;45.94480552,4.732521772
MHR_84_JR0012;Les jardins des pins;Château du Pin;07380;Fabras;Auvergne-Rhône-Alpes;Ardèche;44.64863546;4.290273786;Jardin d'artiste contemporain privé de 3 hectares, conçu par Martine Diersé autour d'un château du XVIe siècle. Composé en trois parties, il accueille des sculptures contemporaines et fleurs de céramique installées parmi les roses anciennes, iris, pivoines, glycines, plantes aromatiques et potagères. Ouvert de mai à octobre et sur RV.;http://www.chateaudupin.org;https://www.facebook.com/Ch%C3%A2teau-et-jardins-du-Pin-Association-Colette-Bonzo-263505440848452/;;;;labellisee-en-2011;jardin-remarquable;;;;;;;;;jardin-prive;jardin-contemporain;;;;;;;44.64863546,4.290273786
MHR_84_JR0016;Parc de la Tête d'Or;Parc de la Tête d'Or;69006;Lyon;Auvergne-Rhône-Alpes;Rhône;45.77740768;4.855226129;Parc de la ville de Lyon de 105 hectares créé par les frères Bühler en 1857. L'entrée principale Porte des Enfants du Rhône ouvre sur la perspective d'un lac de 16 hectares, centre de la composition paysagère. Il est orné de deux roseraies (plus de 400 variétés), d'arbres remarquables et d'une importante statuaire. Le parc comprend également un jardin botanique avec ses grandes et petites serres et sa roseraie qui retrace l'histoire de la rose, un jardin zoologique dont une partie a été réaménagée en Plaine africaine en 2005. Ouvert toute l'année.;http://www.lyon.fr;https://www.facebook.com/Parc-de-la-T%C3%AAte-dor-29597219628/;;;;labellisee-en-2006;jardin-remarquable;;monument-historique;;;;;;;;;parc-paysager;;jardin-de-collection;jardin-public;;;45.77740768,4.855226129
MHR_84_JR0021;Parc Jouvet;avenue de la Comète;26000;Valence;Auvergne-Rhône-Alpes;Drôme;44.92956445;4.885482788;"Parc public de 7 hectares, créé au début du XXe siècle par des architectes paysagistes de renom (Vacherot, Redont, Touret, Martinet) ; de style composite il associe style à la française et décor paysager. Ouvert toute l'année.";;https://www.facebook.com/pages/Parc-Jouvet/1437159116515481;;;;labellisee-en-2006;jardin-remarquable;;;protection-site;;;;;;;;parc-paysager;jardin-regulier;;jardin-public;;;44.92956445,4.885482788
MHR_84_JR0025;Parc du château du Touvet;allée du château;38660;Le Touvet;Auvergne-Rhône-Alpes;Isère;45.36348282;5.946582109;A l’ombre du château, les jardins aménagés en 1750 sur 5 hectares, s’organisent autour d’un remarquable escalier d’eau à l’italienne alimenté par les eaux vives du massif de Chartreuse. Longues terrasses, buis et ifs savamment taillés, jardin clos, roseraie, bassins et fontaines ponctuent l’ensemble avec art.;http://www.chateaudutouvet.com;https://www.facebook.com/Jardins-Ch%C3%A2teau-du-Touvet-152706664760316;;;;labellisee-en-2004;jardin-remarquable;;monument-historique;;;;;;;jardin-prive;;;jardin-regulier;;;;;45.36348282,5.946582109
MHR_84_JR0029;Jardin botanique;4 chemin du Jardin botanique;42400;Saint-Chamond;Auvergne-Rhône-Alpes;Loire;45.466843;4.529454;Jardin botanique de 7000 m², créé par Michel Manevy horticulteur et paysagiste, à partir de 1995 à l'emplacement d'une pépinière qui se mourrait. Construit au fil du temps avec patience, il réunit 4500 espèces végétales mises en scène avec recherche dans le jardin à l'italienne, le jardin blanc, celui de l'homme créateur et celui des simples.;;;;;;labellisee-en-2013;jardin-remarquable;;;;;;;;;jardin-prive;;;;jardin-de-collection;;;;45.466843,4.529454
MHR_04_JR0002;Mascarin Jardin botanique de la Réunion;2 rue du Père Georges;97436;Saint-Leu;Réunion;Réunion;-21.1374;55.2954;A l'origine, ce domaine faisait partie de la vaste propriété agricole (660 ha) de Sosthènes d'Armand de Chateauvieux et de sa descendance, qui vécurent sur ce site depuis 1857. Aujourd'hui, l'immense maison et les dépendances abritent Mascarin Jardin Botanique de La Réunion qui présente 8 collections botaniques différentes et qui a une double mission : la sensibilisation et l'éducation des publics à la préservation des milieux naturels et de la flore indigène locale et la transmission des savoirs culturels réunionnais.;https://www.departement974.fr/mascarin-jardin-botanique;;;;;labellisee-en-2019;jardin-remarquable;;;;;;;;;;;;;jardin-de-collection;jardin-public;jardin-vivrier;;-21.1374,55.2954
