code_id;nom_du_jardin;adresse;code_postal;ville;region;departement;coordonnees_x;coordonnees_y;descriptif;site_web;facebook;twitter;instagram;dailymotion;tag_annee_de_labellisation;tag_jardin_remarquable;tag_maison_des_illustres;tag_monument_historique;tag_protection_site;tag_tourisme_et_handicap;tag_musee_de_france;tag_architecture_contemporaine_remarquable;tag_vpah;tag_patrimoine_mondial_de_lunesco;tag_jardin_prive;tag_jardin_contemporain;tag_parc_paysager;tag_jardin_regulier;tag_jardin_de_collection;tag_jardin_public;tag_jardin_vivrier;tag_jardin_inspiration_medievale;coordonnees_geographiques
MHR_75_JR0057;Parc et jardin du Mas Maury;Le Mas Maury Haut;87120;Rempnat-la-Villeneuve;Nouvelle-Aquitaine;Haute-Vienne;45.677244;1.838006;Les jardins privés du Mas Maury sont une nouvelle création dans un parc ancien du 19e siècle. Sur une superficie de 7 ha, le terrain comprend des prés, des bois, un parc et des jardins. Depuis 2012 les jardins se visitent. Le parc et les jardins du Mas Maury sont situés au cœur du Limousin, à 580 m d’altitude, au carrefour des trois départements, la Haute Vienne, la Creuse et la Corrèze. Le parc, comme la maison – à l’origine un ancien pavillon de chasse – et la grange, datent de 1885. Les jardins actuels ont été aménagés depuis 2006, après le nettoyage du terrain laissé longtemps à l’abandon. Ce travail n’a pas seulement ré-ouvert les belles vues sur le magnifique paysage, mais a aussi permis aux propriétaires actuels de bien connaître et comprendre les lieux.;http://www.jardinsdemasmaury.fr;;;;;labellisee-en-2015;jardin-remarquable;;;;;;;;;jardin-prive;jardin-contemporain;;;;;;;45.677244,1.838006
MHR_93_JR0003;Jardin de l'ancienne abbaye de Valsaintes;Boulinette;04150;Simiane-la-Rotonde;Provence-Alpes-Côte-d'Azur;Alpes-de-Haute-Provence;43.95782344;5.592191219;Un jardin labellisé « Jardin Remarquable » aux pratiques d'entretien 100% naturelles (homéopathie, huiles essentielles, insectes auxiliaires...), une église cistercienne du XVIIe siècle, une terre de mémoire depuis la Préhistoire. Flamboyante alliance du minéral et du végétal dont la Rose en est la reine éphémère. Nature, histoire et spiritualité au coeur d'une Haute-Provence sauvage et préservée pour une balade hors du temps... dans un jardin pas comme les autres !;http://www.valsaintes.org;https://www.facebook.com/jardinabbayevalsaintes/;;https://www.instagram.com/jardin_valsaintes/;;labellisee-en-2011;jardin-remarquable;;;;;;;;;jardin-prive;jardin-contemporain;;;;;;;43.95782344,5.592191219
MHR_93_JR0005;Jardin botanique de la Villa Thuret;90 chemin Raymond;06160;Antibes;Provence-Alpes-Côte-d'Azur;Alpes-Maritimes;43.56350759;7.124376297;"Jardin botanique historique, dans le style des jardins romantiques du XIXe siècle, dirigé par l’Unité de recherche expérimentale Villa Thuret de l’INRA Paca.
 Collections d’arbres et d’arbustes exotiques en cours d’acclimatation dans un parc paysager de 3,5 hectares.";http://www6.sophia.inra.fr/jardin_thuret;https://www.facebook.com/VillaThuretInra/;https://twitter.com/VillaThuretInra;;;labellisee-en-2008;jardin-remarquable;;;;;;;;;;;parc-paysager;;jardin-de-collection;jardin-public;;;43.56350759,7.124376297
MHR_93_JR0014;Arboretum Marcel Kroenlein;Mairie;06420;Roure;Provence-Alpes-Côte-d'Azur;Alpes-Maritimes;44.08984485;7.087453008;L’arboretum Marcel Kroenlein Roure, rassemble les arbres de l’étage montagnard, des Alpes du Sud et des montagnes du monde, une rocaille de sempervium, le patrimoine des rosiers botaniques des Alpes maritimes et un parcours ornithologique;http://www.arboretum-roure.org;https://www.facebook.com/ArboretumRoure/;;;https://www.youtube.com/channel/UCX6BqeNyLha6wcutAbiro7g;labellisee-en-2008;jardin-remarquable;;;;tourisme-et-handicap;;;;;jardin-prive;;;;jardin-de-collection;;jardin-vivrier;;44.08984485,7.087453008
MHR_93_JR0034;Jardin du Las;chemin du Jonquet;83000;Toulon;Provence-Alpes-Côte-d'Azur;Var;43.14;5.90;Créé au XIXe siècle par des marins toulonnais, ce jardin de 15000m², situé en plein coeur de la vallée du Las, accueille des plantes exotiques venues d'Orient, d'Océanie et d'Amérique. A l'entrée, son ordonnancement reste très classique pour s'organiser de plus en plus librement lorsqu'on arrive vers la rivière avec notamment une grande prairie.;https://toulontourisme.com/fiche/jardin-du-las/;;;;;labellisee-en-2013;jardin-remarquable;;;;;musee-de-france;;;;;;;;jardin-de-collection;jardin-public;;;43.14,5.9
MHR_93_JR0035;Parc Gonzalez;134 boulevard du Soleil;83230;Bormes-les-Mimosas;Provence-Alpes-Côte-d'Azur;Var;43.09;6.2043;Ce parc unique en Europe, véritable joyau en plein coeur du village, est composé de plus de 500 espèces de végétaux australiens. Il a vu le jour grâce à la générosité de Vivianne Grimminger et Carmen Martinez. Toutes deux ont ainsi souhaité offrir ce terrain d’une superficie de 3000 m2 afin de sceller leur histoire et celle de la famille Gonzalez à la ville de Bormes les Mimosas, si chère à Roberta Gonzalez, fille du sculpteur Julio Gonzalez. Un geste généreux qui aura permis, en 2002, au Parc Gonzalez, de se concrétiser sous l’impulsion de Gilles Augias, aujourd’hui responsable du Service Espaces Vert de la ville et de Gérard Cavatore, le spécialiste du mimosa.;https://www.bormeslesmimosas.com/fr/quoi-faire/visites-et-patrimoine/les-jardins;;;;;labellisee-en-2015;jardin-remarquable;;;;;;;;;;jardin-contemporain;;;jardin-de-collection;jardin-public;;;43.09,6.2043
MHR_93_JR0037;Jardin de La Gravière;74 avenue des anciens combatants d'AFN;83390;Pierrefeu du Var;Provence-Alpes-Côte-d'Azur;Var;43.221532;6.141143;Situé en contrebas du village de Pierrefeu-du-Var, ce jardin de 13 000 m² est installé sur une ancienne gravière. Le visiteur y est invité à parcourir plusieurs univers harmonieusement combinés. Il sera tout d’abord surpris par une zone ombragée où s’épanouissent des fougères dont une trentaine de sujets arborescents. Poursuivant sa promenade au fil de l’arboretum et sa collection d’érables aux formes et couleurs si variées, il découvrira l’étang principal accueillant une riche végétation aquatique. Plus loin, des végétaux exotiques et notamment des cactées surgissent des massifs de rocailles. Une ombrière abrite un jardin plus intimiste complété par un petit étang où l’eau coule en cascade et dans lequel se mirent de vénérables saules pleureurs. Les collections de bambous, grevilléas, plantes rares et curieuses complètent la richesse de ce lieu que la propriétaire-jardinière se plait à faire évoluer sans cesse.;https://www.parcsetjardinspaca.com/jardins/la-graviere/;;;;;labellisee-en-2017;jardin-remarquable;;;;;;;;;jardin-prive;jardin-contemporain;;;jardin-de-collection;;;;43.221532,6.141143
MHR_93_JR0041;Jardin du château de Val Joanis;Château Val Joanis;84120;Pertuis;Provence-Alpes-Côte-d'Azur;Vaucluse;43.71125404;5.468916893;Jardin constitué de 3 terrasses : un potager d’inspiration XVIIIe siècle, un jardin de rosiers et fruitiers palissés, un jardin pour arbres d’ornement. Prix Jardin 2008.;http://www.val-joanis.com;;;;;labellisee-en-2005;jardin-remarquable;;;;;;;;;jardin-prive;;;jardin-regulier;;;jardin-vivrier;;43.71125404,5.468916893
MHR_93_JR0046;Bambous en Provence;Petit Mas de l'Hermite;13630;Eyrargues;Provence-Alpes-Côte-d'Azur;Bouches-du-RhônePro;43.8466;4.81036;En 2003, Bernard Le Neindre, passionné de jardin, décide de créer un jardin de bambous à Eyragues en Provence, avec comme objectif principal d’agir en faveur du développement durable. Le jardin Bambous en Provence est installé sur 5,5 hectares. Cette plantation constitue un espace au devenir très prometteur, grâce à la croissance remarquable des plantes sur un terrain de qualité, naturellement irrigué et sous un climat exceptionnellement favorable, permettant ainsi d’expérimenter de nouvelles espèces subtropicales. Ce jardin a été conçu pour être une illustration vivante des options essentielles de développement durable, c’est à dire la prise en compte de la terre (protection contre les agressions chimiques, régénération des terres appauvries ou dégradées, reconstitution de l’humus..), de l’air (réduction des pollutions, régénération de l’air pollué,…), de l’énergie solaire (préparer la raréfaction des sources d’énergies) et de l’eau (éviter le gaspillage, les consommations excessives et la pollution).;http://www.bambous-en-provence.com;https://www.facebook.com/bambousenprovence/;;;;labellisee-en-2019;jardin-remarquable;;;;;;;;;jardin-prive;jardin-contemporain;;;jardin-de-collection;;;;43.8466,4.81036
MHR_28_JR0010;Parc Emmanuel Liais;rue de la Bucaille;50100;Cherbourg-Octeville;Normandie;Manche;;;Le parc Emmanuel Liais constitue sans doute le jardin Cherbourgeois le plus pittoresque et le plus apprécié des connaisseurs. Parcouru d'allées au tracé sinueux, le parc est orné d'arbres et d'arbustes d'une taille respectable. Au pied de la tour observatoire, on peut remarquer le plan d'eau contenant nénuphars et autres plantes aquatiques. Les 2 serres abritent des variétés de plantes rares, dont certaines uniques en France voir même au Monde.;http://www.ville-cherbourg.fr/;;;;;labellisee-en-2006;jardin-remarquable;;;;;;;;;;;;;jardin-de-collection;jardin-public;;;
MHR_28_JR0014;Parc du château des Ravalet;avenue du Château;50110;Cherbourg-en-Cotentin;Normandie;Manche;49.6298;-1.5667;Le château est situé dans un superbe parc paysager de 14 hectares, aux sentiers sinueux et aux arbres remarquables. Le parc abrite également un conservatoire du dahlia, et offre une vaste prairie bordée d'espaces naturels.;http://www.ville-cherbourg.fr;;;;;labellisee-en-2004;jardin-remarquable;;monument-historique;;;;;;;;;parc-paysager;jardin-regulier;;jardin-public;;;49.6298,-1.5667
MHR_28_JR0016;Jardin botanique;Château de Vauville;50440;Vauville;Normandie;Manche;49.63424388;-1.846016943;Jardin exotique de plus de 40 000 m² constitué d'arbres et d'arbustes en provenance de l'hémisphère austral.;http://www.jardin.vauville.fr;;;https://www.instagram.com/jardin_de_vauville_officiel/;;labellisee-en-2004;jardin-remarquable;;monument-historique;;;;;;;jardin-prive;;;;jardin-de-collection;;;;49.63424388,-1.846016943
MHR_28_JR0044;Jardin retiré;14 avenue Robert Cousin;61140;Bagnoles-de-l'orne;Normandie;Orne;48.5591;-0.4203;Situé en plein coeur de la Forêt d'Andaines à Bagnoles de l' Orne, ville thermale, une occasion de découvrir, un superbe jardin de mi-ombre, intime et raffiné sur 2500 m2. Dans ce cadre romantique, ceinturé par une haie d'arbustes et d'arbres centenaires, vous pouvez voir s'épanouir au fil des saisons de nombreuses variétés de roses, clématites, vivaces dont les astrances mais plus encore les hostas pour leur feuillage, de nombreux phlox, des persicaires, de nombreux arbustes.... La jardinière ne manque pas de trouver aux roses leurs meilleures associées pour créer des mises en scène tantôt théâtrales, plus discrètes, romantiques ou sauvages. Le Jardin Retiré offre en toute harmonie, une succession d'ambiances : le Jardin Boudoir, le Jardin à l'Anglaise, le Jardin d'eau, l'Allée Blanche, la Serre-Chapelle.;http://www.lejardinretire.fr/;https://www.facebook.com/LeJardinRetire;;;;labellisee-en-2019;jardin-remarquable;;;;;;;;;jardin-prive;jardin-contemporain;;;;;;;48.5591,-0.4203
MHR_28_JR0017;Parc du château du Champ de la Pierre;D555;61320;Champ-de-la-Pierre (Le);Normandie;Orne;48.6084290;-0.2044989;Les parterres près de la maison sont bordés de tilleuls taillés. Dans le parc se trouvent de beaux hêtres, des pins Weymouth. Deux ports, un labyrinthe, plusieurs fabriques, des allées et des perspectives pleines de charme qui font de ce parc préromantique un lieu de délassement et de rêverie. Des salles vertes offrent de beaux points de vue sur l'étang. Près de la maison se trouvent l'ancien potager distribué en quatre carrés comprend une partie légumes et fruits, une partie roseraie et les deux autres parties sont en gazon et en fleurs. Un petit jardin à la française se situe à côté de l'ancien potager.;http://www.lechampdelapierre.com;;;;;labellisee-en-2006;jardin-remarquable;;monument-historique;;;;;;;jardin-prive;;parc-paysager;;;;jardin-vivrier;;48.608429,-0.2044989
MHR_28_JR0032;Jardin de Miromesnil;Château de Miromesnil;76550;Tourville-sur-Arques;Normandie;Seine-Maritime;49.86138571;1.081831455;"""Grand prix 2011"" de la société d'horticulture de France, le jardin potager de Miromesnil est un bel exemple de jardin nourricier traditionnel. 
 Clos de murs du XVIIe siècle, quatre carrés où sont sagement alignés fleurs, fruits et légumes sont entrecoupés par des allées engazonnées longées de mixed borders.
 Dans le parc, les jardins à la française sont évoqués grâce à une tonte judicieuse.
 Cèdre du Liban, hêtre pourpres et autres arbres remarquables vous invitent à la promenade.";http://www.chateaumiromesnil.com;;;;;labellisee-en-2004;jardin-remarquable;maison-des-illustres;;;;;;;;jardin-prive;;;;;;jardin-vivrier;;49.86138571,1.081831455
MHR_28_JR0031;Parc de Galleville;Château de Galleville;76560;Doudeville;Normandie;Seine-Maritime;49.731026;0.789542;Jardin Renaissance entouré de hêtres séculaires, il est d'ordonnance classique. Palissades de tilleuls et longues charmilles taillées encadrant les tapis gazonnés ponctueront votre cheminement vers le vaste jardin de fleurs et d'arbustes rares, puis vers le très joli potager.;http://www.chateaudegalleville.com/;;;;;labellisee-en-2004;jardin-remarquable;;;;;;;;;jardin-prive;;;jardin-regulier;;;jardin-vivrier;;49.731026,0.789542
MHR_32_JR0020;Jardin du donjon de Vez;Donjon de Vez;60117;Vez;Hauts-de-France;Oise;49.26330938;3.001014367;La forteresse médiévale de Vez (XIIIe et XIVe siècles), monument historique classé, est un lieu de promenade situé dans la magnifique vallée de l'Automne mais aussi un lieu ouvert à l'art moderne et contemporain qui accueille une grande exposition de sculptures.;http://www.donjondevez.com;;;;;labellisee-en-2004;jardin-remarquable;;;;;;;;;jardin-prive;jardin-contemporain;;;;;;;49.26330938,3.001014367
MHR_32_JR0026;Parc et roseraie du château-fort de Rambures;8 rue du Château;80140;Rambures;Hauts-de-France;Somme;49.9445206;1.707346737;Quinze hectares de parc romantique à l'anglaise, labellisé « Jardin remarquable » et protégé au titre des Monuments Historiques, entourent la forteresse médiévale de Rambures. Ses allées sinueuses permettent la découverte, en plus de l'arboretum, d’un verger-conservatoire, d'un jardin de simples, d'une collection de fougères et d'une roseraie aux 500 variétés de roses.;http://www.chateau-rambures-picardie.fr/;;;https://www.instagram.com/rambures80/;;labellisee-en-2006;jardin-remarquable;;monument-historique;;;;;;;jardin-prive;;parc-paysager;;jardin-de-collection;;jardin-vivrier;;49.9445206,1.707346737
MHR_32_JR0027;Herbarium des remparts;36 rue Brandt;80230;Saint-Valery-sur-Somme;Hauts-de-France;Somme;50.187616;1.628518;L’Herbarium est un jardin public original de 1700 m². Niché sur les hauteurs de la cité médiévale, il se décline sur 4 terrasses et propose, autour d’un vieux pommier centenaire, des plantes aux multiples vertus (médicinales, aromatiques, textiles, tinctoriales, historiques…) ainsi qu’une diversité botanique des différents milieux naturels de la région.;;;;;;labellisee-en-2004;jardin-remarquable;;;protection-site;;;;;;jardin-prive;jardin-contemporain;;;;jardin-public;jardin-vivrier;jardin-inspiration-medievale;50.187616,1.628518
MHR_32_JR0028;Jardin des ifs;3 impasse du Vidamé;60380;Gerberoy;Hauts-de-France;Oise;49.53374;1.85062;"La propriété se compose d’une maison entre cour avec dépendances au Sud et jardin au Nord, datant de la première moitié du XVIIIe siècle. C’était la maison de Charles Levesque de La Roque, lieutenant général du vidamé de Gerberoy. 
 Le jardin qui couvre environ 1600 m² est un jardin historique en terrasses planté d’ifs en topiaire pluri-séculaires. Il s'agit d'un jardin très vert, à l'origine dénué de fleurs. Les rosiers ont été ajoutés par les propriétaires actuels pour donner de la couleur et de nouveaux parfums au jardin. Les buis les plus anciens sont les plus proches de la maison. Rotondiformes, ils ont entre 150 et 200 ans. L'allée centrale du jardin prolonge le vestibule de la maison, et se déroule jusqu'à un surprenant cabinet de verdure en if taillé, qui a obtenu le label ""Arbre remarquable de France"". En contrebas du cabinet de verdure et au pied d'un escalier ancien, se trouve le potager.";http://www.lejardindesifs.com/;https://www.facebook.com/lejardindesifs;;;;labellisee-en-2018;jardin-remarquable;;;protection-site;;;;;;jardin-prive;;;jardin-regulier;;;jardin-vivrier;;49.53374,1.85062
MHR_24_JR0014;Parc et jardins du château de Chenonceau;Château;37150;Chenonceau;Centre-Val de Loire;Indre-et-Loire;47.32491963;1.070222855;Jardins d'esprit Renaissance et labyrinthe végétal (80 hectares).;http://www.chenonceau.com;;;https://www.instagram.com/chateau_chenonceau/;;labellisee-en-2004;jardin-remarquable;;monument-historique;;tourisme-et-handicap;;;;;jardin-prive;;;jardin-regulier;;;jardin-vivrier;;47.32491963,1.070222855
MHR_24_JR0018;Roseraie des terrasses de l'évêché;Place Saint-Louis;41000;Blois;Centre-Val de Loire;Loir-et-Cher;47.58835806;1.336094141;Située sur les terrasses de l'Evêché, la roseraie présente une collection de roses modernes et anciennes associées à des graminées.;http://www.blois.fr/;;;;;labellisee-en-2004;jardin-remarquable;;monument-historique;;;;;vpah;;;jardin-contemporain;;;jardin-de-collection;jardin-public;;jardin-inspiration-medievale;47.58835806,1.336094141
MHR_24_JR0025;Parc du manoir de la Javelière;10 route de la Javelière;45340;Montbarrois;Centre-Val de Loire;Loiret;48.04328029;2.409648299;"Les jardins de la Javelière présentent des décors très variés : une roseraie moderne, un parc à l'anglaise agrémenté de nombreux arbres et arbustes de collection, un jardin d'inspiration italienne, un décor japonisant, des topiaires, un jardin potager... Un sentier bordé de roses anciennes et de lavandes sinue autour d'un étang aux eaux turquoises. Le 'Rosarium"" possède une importante collection de rosiers botaniques riche de 300 taxons et agréée par le CCVS (Conservatoire des Collections Végétales Spécialisées).";http://www.lajaveliere.fr;;;;;labellisee-en-2012;jardin-remarquable;;;;;;;;;jardin-prive;jardin-contemporain;parc-paysager;jardin-regulier;jardin-de-collection;;;;48.04328029,2.409648299
MHR_24_JR0027;Parc floral de la Source;avenue du Parc floral;45000;Orléans;Centre-Val de Loire;Loiret;47.8476;1.9377;Le Jardin de La Source : d'amples massifs de fougères ponctués de rhododendrons épaulent la sente qui mène, en un parcours intimiste, à la source du Loiret. Une végétation de sous-bois et des filets d'eau coulant sur des pavés suggèrent la présence de cette source toute proche. Unique en France avec celle du Vaucluse, résurgence karstique de la Loire, la source du Loiret est la curiosité majeure du Parc Floral. Le visiteur peut également se promener en pleine nature dans le sous-bois du plateau de Sologne, à l'ombre des grands arbres, à l'écoute des 96 espèces d'oiseaux qui fréquentent les lieux. Des jardins de dahlias, d'annuelles, de fuschias ainsi qu'un potager complètent la promenade en ce lieu enchanteur. Collection Nationale d'iris et de clématites.L;http://www.parcfloraldelasource.com;;;;;labellisee-en-2009;jardin-remarquable;;;;;;;;;;jardin-contemporain;parc-paysager;jardin-regulier;jardin-de-collection;jardin-public;;;47.8476,1.9377
MHR_53_JR0017;Jardins de Brocéliande;Les Mesnils;35310;Bréal-sous-Montfort;Bretagne;Ille-et-Vilaine;48.05395973;-1.889876425;Contemplatifs et amoureux botanistes font ici l’expérience d’une diversité de couleurs et d’arômes, explorant collections florales, parcours sensoriels atypiques et jardins thématiques. Lieu d’insertion de personnes en situation de handicap. Nombreuses animations (24 ha).;http://www.jardinsdebroceliande.fr;https://www.facebook.com/JardinsdeBroceliande/?ref=bookmarks;;https://www.instagram.com/jardinsdebroceliande/;;labellisee-en-2006;jardin-remarquable;;;;tourisme-et-handicap;;;;;jardin-prive;jardin-contemporain;;;;;;;48.05395973,-1.889876425
MHR_53_JR0018;Jardin du Soleil Levant dans le parc botanique de Haute-Bretagne;parc floral de Haute-Bretagne;35133;Châtellier;Bretagne;Ille-et-Vilaine;48.42979811;-1.26071468;Jardin d’inspiration japonaise, au cœur d’un ensemble de vingt-quatre jardins à thèmes créé à partir de 1995 dans le parc d'un château.;https://www.jardinbretagne.com/;https://www.facebook.com/parcfloralbretagne/;;;;labellisee-en-2005;jardin-remarquable;;;;tourisme-et-handicap;;;;;jardin-prive;jardin-contemporain;;;jardin-de-collection;;;;48.42979811,-1.26071468
MHR_27_JR0008;Potager fleuri du château de Lantilly;Lantilly 21140;21140;Lantilly;Bourgogne - Franche-Comté;Côte-d'Or;47.4892258;4.334720671;Parc à l'anglaise planté au XIXe siècle avec potager fleuri.;https://www.chateau-lantilly.fr;https://www.facebook.com/Lantilly/;;;;labellisee-en-2004;jardin-remarquable;;monument-historique;;;;;;;jardin-prive;jardin-contemporain;parc-paysager;;;;jardin-vivrier;;47.4892258,4.334720671
MHR_27_JR0021;Parc du château d'Ouge;1-3 rue du Colombier;70500;Ouge;Bourgogne - Franche-Comté;Haute-Saône;47.7970057;5.704436302;"Le parc entoure le château construit dans le courant du XVIe siècle. Plus de 300 arbres de haut jet, comprenant 90 espèces, et 1500 arbustes ont été plantés depuis 1980. Jardin Renaissance dans la cour d’honneur ; petit jardin à la française au sud, avec fontaine et bassin ; jardin asiatique autour du plan d’eau. Les végétaux sont étiquetés.";;;;;;labellisee-en-2011;jardin-remarquable;;;;;;;;;jardin-prive;;parc-paysager;jardin-regulier;;;;;47.7970057,5.704436302
MHR_84_JR0009;Jardins du château d'Opme;Château d'Opme;63540;Romagnat;Auvergne-Rhône-Alpes;Puy-de-Dôme;45.69204317;3.084486723;Dans l'esprit du XVIIe siècle, ce double jardin en terrasses vous séduira. Le premier jardin est régulier avec un grand bassin, le second est un potager ornemental avec des fontaines et des jeux d'eau.;;;;;;labellisee-en-2004;jardin-remarquable;;monument-historique;;;;;;;jardin-prive;;;jardin-regulier;;;jardin-vivrier;;45.69204317,3.084486723
MHR_84_JR0011;La Terre Pimprenelle;La Terre Pimprenelle;07440;Alboussière;Auvergne-Rhône-Alpes;Ardèche;44.9445959;4.729966968;Jardin paysager privé (1 hectare), créé en 2001 par Raphaël Benedetti, structuré sur le nombre d'or. Pénétrez dans les ellipses et les spirales pour découvrir des plantes rares aux formes et feuillages méconnus, d'originales pierres géantes, des oeuvres d'art. Des bassins et un ruisseau accueillent des plantes aquatiques. Ouvert toute l'année.;http://sites.google.com/site/jardinlaterrepimprenelle/;https://www.facebook.com/Jardin-La-Terre-Pimprenelle-Alboussi%C3%A8re-Ard%C3%A8che-1705871403013532/;;;;labellisee-en-2011;jardin-remarquable;;;;;;;;;jardin-prive;jardin-contemporain;;;jardin-de-collection;;;;44.9445959,4.729966968
MHR_84_JR0018;Domaine départemental de Lacroix-Laval;1171, ave de Lacroix-Laval;69280;Marcy-l’Étoile;Auvergne-Rhône-Alpes;Rhône;45.78847692;4.713534415;Ce domaine public de 115 hectares comprend un jardin régulier, un potager conservatoire de 5000 m², un jardin anglais, puis des zones plus naturelles où alternent prairies et forêts dans un paysage vallonné. Les dernières interventions en matière de composition intervenues entre 1919 et 1925 sont attribuées aux paysagistes Achille Duchêne et Linossier. Entre espaces naturels et paysages, prairies et forêts, jardin à la française et parc à l'anglaise, potager et serre, tous sont articulés autour du château. Des kilomètres de chemins sont aménagés ainsi que 2 km de parcours de santé ainsi que de nombreuses animations autour de la nature et de l'environnement.;https://www.grandlyon.com/parcs/domaine-de-lacroix-laval.html;;;;;labellisee-en-2015;jardin-remarquable;;;;;;;;;;jardin-contemporain;parc-paysager;jardin-regulier;jardin-de-collection;jardin-public;jardin-vivrier;;45.78847692,4.713534415
MHR_84_JR0020;Jardin des herbes;Le Bourg;26700;La Garde Adhémar;Auvergne-Rhône-Alpes;Drôme;44.39257962;4.752174318;Créé en 1990 par Danielle Arcucci, ce jardin public contemporain de 3000 m² domine la vallée du Rhône. Regroupées par forme, couleur et vertus médicinales, 200 herbes ornent les terrasses selon différents dessins géométriques, passages ombrés, cascade, et parterre en forme de soleil. Ouvert toute l'année et sur RV pour les VG.;http://www.la-garde-adhemar.com;;;;;labellisee-en-2006;jardin-remarquable;;;protection-site;;;;;;;jardin-contemporain;;;jardin-de-collection;jardin-public;jardin-vivrier;;44.39257962,4.752174318
MHR_84_JR0023;Jardin des Cinq sens;rue du Lac;74140;Yvoire;Auvergne-Rhône-Alpes;Haute-Savoie;46.370888;6.325697;Situé sur les rives du lac Léman, ce Jardin privé de 2500 m2 est un écrin végétal inspiré des labyrinthes du Moyen-Age. Plusieurs jardins intimistes invitent à l’éveil des sens et à la découverte d’une grande diversité de plantes. Cette œuvre vivante a été créée par Yves et Anne-Monique d’Yvoire avec le concours d’Alain Richert et d’André Gayraud,;http://www.jardin5sens.net;https://www.facebook.com/jardin5sens/;;https://www.instagram.com/jardin5sens/;;labellisee-en-2004;jardin-remarquable;;;;;;;;;jardin-prive;jardin-contemporain;;jardin-regulier;;;jardin-vivrier;jardin-inspiration-medievale;46.370888,6.325697
