code_id;nom_du_jardin;adresse;code_postal;ville;region;departement;coordonnees_x;coordonnees_y;descriptif;site_web;facebook;twitter;instagram;dailymotion;tag_annee_de_labellisation;tag_jardin_remarquable;tag_maison_des_illustres;tag_monument_historique;tag_protection_site;tag_tourisme_et_handicap;tag_musee_de_france;tag_architecture_contemporaine_remarquable;tag_vpah;tag_patrimoine_mondial_de_lunesco;tag_jardin_prive;tag_jardin_contemporain;tag_parc_paysager;tag_jardin_regulier;tag_jardin_de_collection;tag_jardin_public;tag_jardin_vivrier;tag_jardin_inspiration_medievale;coordonnees_geographiques
MHR_27_JR0032;Parc et jardin de Courterolles;1 Grande rue - Courterolles;89420;Guillon;Bourgogne - Franche-Comté;Yonne;45.52731;4.08644;Le parc comporte une importante collection d’arbres, d’arbustes et de fleurs qui présentent un intérêt tout au long des quatre saisons. Le printemps est une explosion de fleurs : narcisses, prunus, pivoines, iris… L’été apporte ses couleurs chaudes et ses floraisons tardives : hémorocalles, asters… L’automne est une symphonie de couleurs. En hiver, on découvre les écorces, les formes des arbres, et de nombreuses floraisons comme celle du lonicera frangantissima qui nous offre aussi son parfum. Le potager est un endroit en perpétuel mouvement : les légumes, les fleurs, les fruits y règnent au fil des saisons. Le parc comporte aussi plusieurs oeuvres d’art créées par de jeunes artistes et artisans locaux : le ponton de la baignade, le banc de l’île, la fontaine à kiwis dans le potager ou la grande chaise haute du parc qui offre une vue dominante.;https://chateaudecourterolles.com/;;https://twitter.com/intent/tweet?via=wordpressdotcom&text=Visites&url=https%3A%2F%2Fchateaudecourterolles.com%2Fvisites%2F;;;labellisee-en-2020;jardin-remarquable;;;;;;;;;jardin-prive;jardin-contemporain;parc-paysager;;;;jardin-vivrier;;45.52731,4.08644
MHR_11_JR0003;Parc de Courson;Domaine de Courson;91680;Courson-Monteloup;Île-de-France;Essonne;48.59999802;2.146883011;Parc romantique, fruit du travail des meilleurs paysagistes des XIXe et XXe siècles (Louis-Martin Berthault, Denis et Eugène Bühler, Timothy Vaughan, Ernest de Caraman, Louis Benech), où se marient en toute saison botanique et esthétique, ce parc invite à la promenade dans une étonnante ambiance de paix et de sérénité. Floraisons d'été (roses, hortensias, asters, azalées, rhododendrons et couleurs d'automne).;http://www.domaine-de-courson.fr;;;;;labellisee-en-2004;jardin-remarquable;;monument-historique;protection-site;;;;;;jardin-prive;;parc-paysager;;jardin-de-collection;;;;48.59999802,2.146883011
MHR_11_JR0015;Parc du château de Vaux-le-Vicomte;Domaine de Vaux le Vicomte;77950;Maincy;Île-de-France;Seine-et-Marne;48.54536456;2.717571259;Vaux le Vicomte est l’œuvre fondatrice de l’art du jardin à la française. La parfaite harmonie entre jardin et architecture est issue du génie fraternel de trois hommes réunis par Fouquet, le jardinier André Le Nôtre, l'architecte Louis Le Vau, et le peintre-décorateur Charles Le Brun.;http://www.vaux-le-vicomte.com;;;https://www.instagram.com/chateauvlv/;;labellisee-en-2004;jardin-remarquable;;monument-historique;;;;;;;jardin-prive;;;jardin-regulier;;;;;48.54536456,2.717571259
MHR_11_JR0024;Roseraie du Val-de-Marne;rue Albert Watel;94240;L'Haÿ-les-Roses;Île-de-France;Val-de-Marne;48.776257;2.334602773;Œuvre de Jules Gravereaux, la Roseraie fut dessinée en 1899 par Edouard André. Il s’agit de la première roseraie occidentale. Véritable conservatoire vivant de roses anciennes, la roseraie actuelle présente une chronologie de collections exceptionnelles.;http://www.roseraieduvaldemarne.fr;;;;;labellisee-en-2011;jardin-remarquable;;monument-historique;;;;;;;;;;jardin-regulier;jardin-de-collection;jardin-public;;;48.776257,2.334602773
MHR_11_JR0026;Domaine national de Rambouillet;Place de la Libération ou Grille de la Motte;78120;Rambouillet;Île-de-France;Yvelines;48.64073587;1.812057495;Le domaine de Rambouillet est une résidence d'automne pour les présidents de la République. L'aménagement du parc régulier, conçu par Fleuriau d'Armenonville, date de 1699. Il comprenait terrasses, parterres et quinconces de tilleuls. A partir du grand canal qui traverse le domaine, il fit creuser un réseau de canaux secondaires dessinant un chapelet d'îles géométriques jadis peuplées de statues et devenues aujourd'hui des refuges pour la flore sauvage.;http://www.monuments-nationaux.fr;;;;;labellisee-en-2004;jardin-remarquable;;monument-historique;protection-site;;;;;;;;parc-paysager;jardin-regulier;;jardin-public;;;48.64073587,1.812057495
MHR_11_JR0030;Potager du roi;10 rue du Maréchal Joffre;78000;Versailles;Île-de-France;Yvelines;48.79887824;2.123494148;Le Potager du Roi a été construit entre 1678 et 1683 par Jean-Baptiste La Quintinie à la demande de Louis XIV. Ce jardin de 9 hectares est structuré autour d'une partie centrale, le Grand carré, composé de 16 parcelles de culture maraîchère. Tout autour, des parcelles clos de mur accueillent environ 5000 arbres fruitiers principalement des poiriers (142 variétés) et des pommiers (198 variétés).;http://www.potager-du-roi.fr;;;https://www.instagram.com/ensp.potagerduroi/;;labellisee-en-2004;jardin-remarquable;;monument-historique;;;;;;;;;;jardin-regulier;;jardin-public;jardin-vivrier;;48.79887824,2.123494148
MHR_11_JR0037;Jardin des Tuileries;rue de rivoli;75001;Paris;Île-de-France;Paris;48.8634;2.3275;"Au cœur de Paris, ce jardin de 23 hectares, situé entre le Louvre et la place de la Concorde et bordé par la Seine et la rue de Rivoli, est fréquenté chaque année par environ 14 millions de visiteurs. Depuis 2005, c’est le musée du Louvre qui en assure la gestion et la mise en valeur. Classé Monument historique en 1914, il est également inscrit au patrimoine mondial de l’UNESCO depuis 1991, dans le cadre des ""Rives de la Seine"".
 Depuis le Moyen Âge, des tuiliers et des potiers étaient actifs à cet emplacement, d’où le nom de ""Tuileries"". Au XVIe siècle, le jardin a été voulu par Catherine de Médicis, la veuve du roi Henri II, et conçu pour être admiré depuis le palais des Tuileries qu’elle faisait construire. D’abord jardin royal, il est devenu au XVIIe siècle l’un des premiers jardins parisiens ouverts au public.
 Quelques grands noms de paysagistes sont à retenir : André Le Nôtre, qui redessine le jardin à partir de 1664, et, récemment, Pascal Cribier et Louis Benech, qui l’ont rénové dans le cadre du ""Grand Louvre"".";https://www.louvre.fr/departments/jardins-du-carrousel-et-des-tuileries;;;;;labellisee-en-2019;jardin-remarquable;;monument-historique;protection-site;;musee-de-France;;;;;;;jardin-regulier;;jardin-public;;;48.8634,2.3275
MHR_11_JR0039;Jardin du musée de l'outil;2 rue de la Mairie;95420;Wy-dit-Joli-Village;Île-de-France;Val-d'Oise;49.1029;1.8348;Le musée de l'Outil et le jardin ont été créés par Claude Pigeard surnommé le « jardinier forgeron » et sa femme Françoise. Ce jardin a une superficie d’un peu plus de 1500 m² où fleurs, plantes, arbustes plantes médicinales et de nombreuses variétés de rosiers se côtoient. Il recèle une grande diversité. Ce jardin est ouvert au public dans le cadre de la visite du musée de l’outil et de visites scolaires. De nombreuses activités sont organisées autour du végétal.;https://www.valdoise.fr/610-musee-de-loutil.htm;https://www.facebook.fr/musee.archeologique.valdoise;;;;labellisee-en-2019;jardin-remarquable;;;;;;;;;;jardin-contemporain;;;;jardin-public;jardin-vivrier;;49.1029,1.8348
MHR_11_JR0040;Arboretum de la Vallée-aux-Loups;102 rue Chateaubriand;92290;Chatenay-Malabry;Île-de-France;Hauts-de-Seine;48.7734;2.2677;Situé au cœur du Domaine de la Vallée-aux-Loups, l’Arboretum suggère des balades dans une atmosphère paisible. Son charme est tout autant lié à sa situation protégée au creux du vallon, à son histoire, qu’à son impressionnante collection végétale. Composé initialement d’un jardin à la française en son cœur et de terres nourricières autour, ce domaine aristocratique a évolué au XIXe siècle, le jardin à la française faisant place à un jardin anglais, suivant les goûts de l’époque en matière paysagère. En 1890, les pépinières Croux investissent le domaine et utilisent le jardin anglais comme parc de démonstration de leurs arbres pour leur clientèle et les terres agricoles alentours deviennent des terrains de production horticole. La majeure partie des arbres centenaires remarquables de l’Arboretum est l’héritage de cette vitrine prestigieuse. Au début du XXe siècle, les pépinières Croux sont considérées comme les plus importantes de France, tant au niveau de la taille de l’exploitation que de la variété et de la qualité des végétaux proposés. L’Arboretum abrite également une collection de Convolvulacées confiée par le botaniste et créateur Patrick Blanc, qui est reconnue depuis 1999 comme collection nationale par le Conservatoire des Collections Végétales Spécialisées (CCVS). En 2013, le Département fait l’acquisition de 66 bonsaïs issus de la collection du spécialiste français Remy Samson, qui exposait sa production à deux pas de l’Arboretum. Ces arbres miniatures, d’espèces et de styles variés et dont certains sont très âgés, sont aujourd’hui présentés dans une serre dédiée.;http://vallee-aux-loups.hauts-de-seine.fr/;https://www.facebook.com/Valleeauxloups.Chateaubriand/;https://twitter.com/chateaubriandvl;https://www.instagram.com/valleeauxloups/;;labellisee-en-2004;jardin-remarquable;;;protection-site;;;;;;;;parc-paysager;;jardin-de-collection;jardin-public;;;48.7734,2.2677
MHR_44_JR0002;Jardin de l'Escalier;10 rue de Pfaffenhoffen;67170;06 08 69 55 68;Grand-Est;Bas-Rhin;48.73682938;7.708623111;"Mélange de styles entre espace arboré, jardin potager, verger, forêt de bambous.
 Une pergola marque l’entrée dans le jardin. L’allée gravillonnée qui se déroule entre un jardin méditerranéen et un jardin d’ombre conduit au potager inspiré des carrés de simples médiévaux. Un bassin crée une transition avec le verger de rosacées, qui débouche sur un jardin zen cerné de bambous. Le parcours s’achève dans l’agora avec son pavillon sur pilotis d’influence japonaise.";http://www.a-lescalier.com;;;;;labellisee-en-2008;jardin-remarquable;;;;;;;;;jardin-prive;jardin-contemporain;;;;;;;48.73682938,7.708623111
MHR_44_JR0005;Domaine du Windeck;51 rue Principale;67530;Otrott;Grand-Est;Bas-Rhin;48.45866494;7.427916527;Le parc couvre une ancienne seigneurie, dite de Windeck, acquise en 1834 des héritiers de la famille de Pascalis par le colonel Laurent-Atthalin. Son gendre Armand Théodore de Dartein réalisa selon un plan longuement préparé un parc où se succèdent massifs d’arbres, larges prairies, pièces d’eau avec de belles perspectives sur la maison, le village, le Mont Sainte-Odile…;http://www.foyer-ottrott.com/;;;;;labellisee-en-2006;jardin-remarquable;;monument-historique;;;;;;;jardin-prive;;parc-paysager;;;;;;48.45866494,7.427916527
MHR_44_JR0023;Jardin de Vergentière;14 rue Candrée;52600;Cohons;Grand-Est;Haute-Marne;47.78847889;5.342230797;Conçu au cours de la première moitié du XIXe siècle, cet ensemble comprend un parc pittoresque tracé vers 1806 et un jardin vivrier conçu à partir de 1820, dominé par deux cèdres du Liban plantés en 1828. Atteignant parfois 4 m de haut, les soutènements des jardins vivriers constituent d'exceptionnels ouvrages de pierre sèche. En cours de restauration, ces jardins seront à nouveau dévolus à la vigne, aux légumes et aux arbres fruitiers. Des pêchers ont été palissés sur un treillage inspiré par ceux de l’époque de Denis Diderot.;https://www.jardin-cohons.fr/;;;;;labellisee-en-2015;jardin-remarquable;;;;;;;;;;;parc-paysager;;;jardin-public;jardin-vivrier;;47.78847889,5.342230797
MHR_44_JR0027;Jardin de l'horticulture;5 bis rue du Comte de Lambertye;51200;Epernay;Grand-Est;Marne;49.03332416;3.950963616;Créé à partir de 1910 sur les plans de J.B. Thomereau, paysagiste, le parc met en scène de nombreuses essences rares parmi lesquelles un fau de Verzy, un hêtre à feuilles de fougère, un hêtre marginé de rose, un muscadier, un cyprès chauve, …. Cette collection est complétée d’une roseraie et d’un verger-école toujours gérés par la Société d’horticulture et de viticulture d’Épernay.;http://www.epernay.fr;;;;;labellisee-en-2012;jardin-remarquable;;;;;;;;;;;parc-paysager;;;jardin-public;;;49.03332416,3.950963616
MHR_44_JR0029;Parc de Champagne;10 avenue du Général Giraud;51100;Reims;Grand-Est;Marne;49.24076;4.055797;Melchior de Polignac, petit fils de la veuve Pommery, confie en 1907 au paysagiste rémois Édouard Redont, la création d’un parc arboré de 22 ha destiné au personnel de la célèbre maison de champagne. Le parc est ouvert depuis 3 ans, lorsqu’en 1913, Georges Hébert, fondateur d’une méthode « naturelle » pour former des sportifs, y installe le premier Collège d’Athlètes. Détruit par la guerre, le site sera restauré en 1922. Rebaptisés Parc de Champagne en 2004, les lieux sont aujourd’hui gérés par la ville de Reims.;https://www.reims.fr/qualite-de-vie-environnement/reims-l-effervescence-cote-nature/les-grands-parcs/le-parc-de-champagne-4712.html;;;;;labellisee-en-2015;jardin-remarquable;;monument-historique;;;;;;patrimoine-mondial-de-lunesco;;;parc-paysager;;;jardin-public;;;49.24076,4.055797
MHR_44_JR0031;Le Clos de Saint-Saturnin;2, Place de la Mairie;51260;Saint-Saturnin;Grand-Est;Marne;48.61351372;3.902923241;"Le terrain humide et calcaire de la vallée de la Superbe confère une ambiance particulière à ce parc de 4 ha créé en 1985. Le site comprend un arboretum, une bambousaie d’une centaine d’espèces ou variétés, un jardin de vivaces et un potager biologique.
 Les abords de la rivière forment un marais calcaire classé Natura 2000.";https://www.leclosdesaintsaturnin.fr/index.php;;;;;labellisee-en-2015;jardin-remarquable;;;;;;;;;jardin-prive;jardin-contemporain;;;jardin-de-collection;;;;48.61351372,3.902923241
MHR_44_JR0042;Jardin du château de Pange;Rue des Tilleuls;57530;Pange;Grand-Est;Moselle;49.08345158;6.353831291;"""Jardin dans la campagne et campagne dans le jardin"", Pange est une ode à la nature. Conçu par le paysagiste Louis Benech, ce jardin résolument contemporain et champêtre s'intègre à merveille dans la splendide campagne environnante.";http://www.chateaudepange.fr;;;;;labellisee-en-2004;jardin-remarquable;;;;;;;;;jardin-prive;jardin-contemporain;;;;;;;49.08345158,6.353831291
MHR_84_JR0008;Parc du domaine royal de Randan;place Adélaïde d'Orléans;63310;Randan;Auvergne-Rhône-Alpes;Puy-de-Dôme;46.01511484;3.357798457;Les jardins et le parc représentent l'une des plus importantes créations paysagères de la première moitié du XIXe siècle, conjuguant influences françaises, anglaises et italiennes, perpétuant la tradition du jardin paysager du XVIIIe siècle. Parmi les bâtiments, découvrez la grande orangerie construite vers 1835 et les serres, répliques de celles de Versailles aujourd'hui disparues. Observez l'exceptionnelle terrasse formant perspective entre le château et la chapelle : elle conserve son mobilier de jardin d'origine et offre un panorama sur des paysages préservés. Déambulez à votre guise dans les 40 hectares ouverts à la visite.;http://www.domaine-randan.fr;https://www.facebook.com/DomaineRandan/;;;;labellisee-en-2006;jardin-remarquable;;monument-historique;;;;;;;;;parc-paysager;;;;;;46.01511484,3.357798457
MHR_84_JR0015;La Bonne Maison;99 chemin de Fontanières;69350;La Mulatière;Auvergne-Rhône-Alpes;Rhône;45.74189703;4.808973446;Entièrement clos de murs et dominant la Saône, ce jardin contemporain privé d'un hectare créé par Madame Masquelier est composé d'une succession de jardins clos. Il abrite une collection unique de roses anciennes et botaniques. 80 variétés de clématites, 60 variétés de narcisses, une collection de pivoines, de viburnums et d'hydrangeas se partagent la vedette. Ouvert du 1er mars au 30 juin et du 1er septembre au 30 octobre. Pour les groupes sur RV.;http://www.labonnemaison.org;;;;;labellisee-en-2011;jardin-remarquable;;;;;;;;;jardin-prive;jardin-contemporain;;;jardin-de-collection;;;;45.74189703,4.808973446
MHR_84_JR0017;Parc de Gerland;avenue Pierre de Coubertin;69007;Lyon;Auvergne-Rhône-Alpes;Rhône;45.72223684;4.823160991;Parc paysager contemporain public de 20 hectares, conçu par Michel Corajoud en 2000 à l'emplacement d'une ancienne friche industrielle. Prairies, mégaphorbiaie plantée de 300 espèces de végétaux issus de milieu humble, jardins thématiques. Ouvert toute l'année.;http://www.lyon.fr;https://www.facebook.com/pages/Parc-de-Gerland/706460642728064;;;;labellisee-en-2006;jardin-remarquable;;;;;;;;;;jardin-contemporain;;jardin-regulier;;jardin-public;;;45.72223684,4.823160991
MHR_84_JR0028;Pépinières et roseraies Paul Croix;2 boulevard d'Almandet;42220;Bourg-Argental;Auvergne-Rhône-Alpes;Loire;45.29846003;4.569403231;Pépinière privée de 5 hectares, créée sous ordonnance royale en 1819 par Adrien Sénéclauze. La famille Croix, obtentrice et créatrice de roses, a transformé une partie de la pépinière en scènes de jardins : 3 roseraies (technique, conservatoire de 18 000 rosiers et 450 variétés de roses anciennes), collection de magnolias, azalées et glycines et parcours des arbres anciens dont érables japonais centenaires.;http://pepinieres-paul-croix.fr;https://www.facebook.com/PepinieresRoseraiesPaulCroix/;;;;labellisee-en-2011;jardin-remarquable;;;;;;;;;jardin-prive;;;;jardin-de-collection;;;;45.29846003,4.569403231
MHR_01_JR0005;Jardin de l'écomusée de la Guadeloupe;Domaine de Lantour Santeil;97115;Sainte-Rose;Guadeloupe;Guadeloupe;16.31519705;-61.70479774;Le jardin de l'éco-musée de la Guadeloupe a été aménagé sur une parcelle familiale d'un demi hectare. Un circuit en boucle permet de traverser différents espaces : jardin de plantes médicinales, aromatiques et culinaires, vitrines des communes de Guadeloupe, atelier pédagogique, allée de la civilisation caribéenne, circuit des épices... En 2008, le jardin créole a intégré un écomusée constitué de cases muséographiées disposées dans le parcours.;http://www.ecomusee.gp;;;;;labellisee-en-2006;jardin-remarquable;;;;;;;;;;;;;jardin-de-collection;;jardin-vivrier;;16.31519705,-61.70479774
MHR_02_JR0002;Jardin de l’habitation Saint-Etienne;Habitation St Etienne;97213;Gros-Morne;Martinique;Martinique;14.686218;-61.006147;Jardin de cinq hectares organisé autour de plusieurs zones thématiques : la palmeraie, le jardin des balisiers et des plantes à fleurs, la pelouse des arbres anciens et monumentaux, la bambouseraie.;http://pnr-martinique.com/visiter/lhabitation-saint-etienne/;https://www.facebook.com/parcnaturelregionaldelamartinique/;;;;labellisee-en-2015;jardin-remarquable;;;;;;;;;jardin-prive;jardin-contemporain;;;;;;;14.686218,-61.006147
MHR_32_JR0001;La ferme du Mont des Récollets;1936 route de Steenvoorde;59670;Cassel;Hauts-de-France;Nord;50.80243057;2.505012229;"Le jardin, créé dans les années 1990, prend son inspiration dans ce que peut représenter ou être un jardin et son environnement dans la Flandre. La retranscription a été d'autant de ""chambres extérieures"" qui pourraient entrer dans l'esprit d'un jardin flamand. En périphérie du jardin, la quasi-totalité des espèces plantées est régionale se retrouvant à l'état spontané dans la nature. Nous laissons prospérer les espèces en liberté dans un but de redécouverte de nos écosystèmes: ainsi se sont installées cardères, cardamines et véroniques des prés, jacinthes des bois, orchidées sauvages... La dominante arbustive plantée est noisetier, érable, viorne, fusain, aubépine et prunellier. Au coeur même du jardin : inspiration de 3 styles de jardins propres à la Flandre: jardin de la Renaissance flamande, jardin traditionnel (XIXe, début XXe) et jardin contemporain";https://www.parcsetjardins.fr/jardins/626-jardins-du-mont-des-recollets;;;;;labellisee-en-2006;jardin-remarquable;;;;;;;;;jardin-prive;jardin-contemporain;;;;;jardin-vivrier;;50.80243057,2.505012229
MHR_32_JR0002;Le manoir aux Loups;300 route de Neuville;59250;Halluin;Hauts-de-France;Nord;50.76974222;3.140888214;Ballade champêtre sur les pentes SUD d'un site vallonné à la découverte d'une collection de conifères et de feuillus qui viennent des 5 continents. 1h30 de visite dans un cadre apaisant et ressourçant. Intérêt botanique et pédagogique le tout empreint de beaucoup de beauté et de sérénité.;http://www.parcmanoirauxloups.fr;;;;;labellisee-en-2004;jardin-remarquable;;;;;;;;;jardin-prive;;parc-paysager;;jardin-de-collection;;;;50.76974222,3.140888214
MHR_32_JR0008;Jardin botanique du beau Pays;3091 Avenue F. Mitterrand;62730;Marck;Hauts-de-France;Pas-de-Calais;50.95;1.99;Jardin avec des nivellements artificiels, ayant des vues très lointaines sur la campagne environnante composée de collections botaniques (2000 taxons), agrémenté de bassin, de dallages en briques , des jardins de gravier , une serre australienne, un salon de thé ainsi qu'une pépinière de plantes vertes (spécialité de pulmonaria).;http://www.jardindubeaupays.fr;;;;;labellisee-en-2015;jardin-remarquable;;;;;;;;;jardin-prive;jardin-contemporain;parc-paysager;;jardin-de-collection;;;;50.95,1.99
MHR_32_JR0014;Potager des Princes;17 rue de la Faisanderie;60500;Chantilly;Hauts-de-France;Oise;49.1957301;2.475610524;Tout au long des 2,5 hectares de visite, les promeneurs découvrent des fabriques de treillages, des cascades, un musée de jardins ainsi que cette année, de nombreux animaux en plus de ceux déjà exposés au Musée Vivant de la Basse Cour Naine créé en 2013 au sein du parc. Le Potager des Princes devient cette année un véritable parc animalier pour le plus grand plaisir des familles.;http://www.potagerdesprinces.com;;;https://www.instagram.com/potagerdesprinces/;;labellisee-en-2005;jardin-remarquable;;monument-historique;;;;;;;jardin-prive;;;jardin-regulier;;;jardin-vivrier;;49.1957301,2.475610524
MHR_32_JR0015;Jardin et parc du château de Compiègne;place du Général De Gaulle;60200;Compiègne;Hauts-de-France;Oise;49.41929542;2.831188291;Le parc du château de Compiègne offre une composition harmonieuse et originale dans un riche environnement patrimonial. Berceau de verdure, offrant une riche floraison printanière, ainsi que des végétaux remarquables (un hêtre pourpre planté sous Napoléon III), le parc du château de Compiègne est un site riche et incontournable pour les passionnés d’horticulture.;http://www.musee-chateau-compiegne.fr;;;;;labellisee-en-2004;jardin-remarquable;;monument-historique;protection-site;;musee-de-france;;;;;;parc-paysager;jardin-regulier;;jardin-public;;;49.41929542,2.831188291
MHR_32_JR0022;Jardin des Plantes;60 boulevard du Jardin des Plantes;80000;Amiens;Hauts-de-France;Somme;49.90155962;2.296431586;Ce jardin dont l'origine remonte au XIIIe siècle est l'un des plus anciens de France. Jardin botanique, créé au XVIIIe siècle par Dom Robbe, prieur du couvent des Feuillants. Jardin régulier, où les buis dessinent les plates-bandes, serre Napoléon III, collection de plantes remarquables.;http://www.amiens-tourisme.fr;;;;;labellisee-en-2015;jardin-remarquable;;;;;;;;;;;;jardin-regulier;jardin-de-collection;jardin-public;;;49.90155962,2.296431586
MHR_32_JR0029;Jardin du Brûle;7 rue Roger Froissart;60112;Herchies;Hauts-de-France;Oise;49.29181;2.00418;Le jardin du Brule est un havre de paix en bord de rivière. L’eau y est omniprésente alternant ruisseau, cascade et étang pour le plaisir des visiteurs. Découvrez une végétation abondante entremêlée d’hortensias, d’asters, de dahlias et de rudbeckias puis on arrive au verger qui nous conduit sur une collection de vivaces multiples et variées sans oublier les rosiers puis le potager avec sa collection de tomates anciennes et légumes sans oublier le petit vignoble.;https://jardindubrule.jimdo.com/;;;https://www.instagram.com/jardindubrule/;;labellisee-en-2018;jardin-remarquable;;;;;;;;;jardin-prive;;parc-paysager;;;;;;49.29181,2.00418
MHR_32_JR0030;Jardin du Moulin Ventin;chemin du Moulin;60120;Paillart;Hauts-de-France;Oise;49.65756;2.27252;Né d'une passion pour la nature, le jardin est une succession de massifs à l'anglaise où se cotoient arbres d'exception, arbuste, vivaces, graminées, plantes aquatiques, rosiers choisies pour floraisons, odeurs, feuillages, couleurs d'automne et originalité autour d'un moulin à eau du XIXe siècle et sa roue restaurée à l'identique. L'eau est partout présente en cascades, bassins, étangs et chemin d'eau. Le jardin offre un lieu de promenade en toutes saisons et évolue constamment. Au détour des allées de buis et de charmilles, poteries, statues, bancs, pergolas, gloriette complètent le décor.;http://jardinmoulinventin-deblock.jimdo.fr/;http://fr-fr.facebook.com/;;;;labellisee-en-2018;jardin-remarquable;;;;;;;;;jardin-prive;jardin-contemporain;parc-paysager;;jardin-de-collection;;;;49.65756,2.27252
